{
  "case_id": "case_06",
  "data_source": "agbonnet",
  "difficulty": "complex",
  "patient_history": {
    "age": 58,
    "sex": "male",
    "chief_complaint": "increasing shortness of breath, dizziness, weakness, and progressive gait and bulbar symptoms after heart transplantation",
    "known_conditions": [
      "non-ischemic cardiomyopathy status post orthotopic heart transplantation",
      "cryptococcal meningitis",
      "atrial flutter",
      "demyelinating polyneuropathy",
      "antibody-mediated cardiac allograft rejection"
    ],
    "known_allergies": []
  },
  "medication_list": [
    "fluconazole",
    "cyclosporine",
    "diltiazem",
    "dexamethasone"
  ],
  "patient_transcript": "Doctor: Good morning, how can I help you today?\nPatient: Good morning, I have been having some increasing shortness of breath, dizziness, and weakness lately.\nDoctor: I see. Can you tell me a little bit about your medical history?\nPatient: Sure, I am an African American male and I have a history of non-ischemic cardiomyopathy. I underwent orthotopic heart transplantation 5 years ago.\nDoctor: Okay, that's good to know. And what happened before you started experiencing these symptoms?\nPatient: Six months ago, I was diagnosed with cryptococcal meningitis.\nDoctor: I see. What kind of treatment did you receive for that?\nPatient: I was given amphotericin B and flucytosine initially, and then I was put on chronic suppressive fluconazole therapy.\nDoctor: Okay, and did you have any changes to your immunosuppression as a result of the infection?\nPatient: Yes, my mycophenolate mofetil dose was reduced from 750 mg BID to 500 mg BID, and my cyclosporine dose from 125 mg BID to 75 mg BID.\nDoctor: I see. And what was your cyclosporine level on admission and discharge?\nPatient: On admission, it was 90 ng/mL, and on discharge, it was 142 ng/mL.\nDoctor: Okay, and did you have any other symptoms before you presented with shortness of breath, dizziness, and weakness?\nPatient: Five months ago, I started to have bilateral hand numbness and tingling, and two weeks ago, I developed imbalance.\nDoctor: I see. During your evaluation, were you found to be in atrial flutter with rapid ventricular response?\nPatient: Yes, that's correct.\nDoctor: And was that rate controlled with diltiazem?\nPatient: Yes, it was.\nDoctor: And what did the echocardiogram show?\nPatient: It showed normal left and right ventricular size and systolic function, with normal diastolic function.\nDoctor: Okay, and while you were in the hospital, did you develop any other symptoms?\nPatient: Yes, I developed progressive dysphagia, gait instability, and profound weakness of my bilateral lower extremities.\nDoctor: I see. And were the head CT and brain MRI unremarkable?\nPatient: Yes, they were.\nDoctor: And what did the lumbar puncture reveal?\nPatient: It showed clear, colorless fluid with an elevated protein level of 147 mg/dL, a normal glucose level of 67 mg/dL, and 5 nucleated cells/mL, of which 85% were lymphocytes.\nDoctor: I see. And what did the nerve conduction studies and electromyogram show?\nPatient: They showed conduction block and prolonged distal latencies, which was suggestive of IDP.\nDoctor: And did you have a positive IgM antibody to Trisulfated Heparan Disaccharide (TS-HDS)?\nPatient: Yes, I did.\nDoctor: Okay, so as treatment for IDP, you underwent four sessions of plasmapheresis and started on high-dose oral dexamethasone, correct?\nPatient: Yes, that's correct.\nDoctor: And did you have significant improvement in your neurologic symptoms?\nPatient: Yes, I did.\nDoctor: Okay, that's great to hear. You were discharged one week later to a physical, correct?\nPatient: Yes, that's correct.\nDoctor: Okay, I would like to see you back in two weeks for a follow-up appointment. We will monitor your progress and make any necessary adjustments to your treatment plan.\nPatient: Okay, thank you.",
  "chart_notes": "58-year-old African American man with non-ischemic cardiomyopathy status post orthotopic heart transplantation 5 years earlier presented with worsening dyspnea, dizziness, and generalized weakness. Six months earlier he had cryptococcal meningitis treated with amphotericin B plus flucytosine, followed by chronic suppressive fluconazole; immunosuppression was reduced, including lower mycophenolate mofetil and cyclosporine doses. Over the preceding months he developed bilateral hand paresthesias and imbalance, and during admission he developed progressive dysphagia, gait instability, and profound bilateral lower-extremity weakness. He was also found to have atrial flutter with rapid ventricular response controlled with diltiazem. Echocardiogram initially showed preserved biventricular function; head CT and brain MRI were unremarkable. Lumbar puncture showed elevated CSF protein with otherwise limited inflammatory findings, nerve conduction studies and electromyography showed conduction block with prolonged distal latencies, and TS-HDS IgM antibody was positive, supporting demyelinating polyneuropathy. He improved after four plasmapheresis sessions plus high-dose oral dexamethasone and was discharged to rehabilitation. Within two weeks he was readmitted with anasarca, worsening graft function, and acute renal failure; endomyocardial biopsy showed C4d-positive chronic inflammation consistent with pAMR2 antibody-mediated cardiac allograft rejection with donor-specific antibody against HLA-DR53. He improved after plasmapheresis plus IVIG and continued immunosuppression, though the overall course remained high risk."
}
