{
  "case_id": "case_04",
  "data_source": "agbonnet",
  "difficulty": "complex",
  "patient_history": {
    "age": 0,
    "sex": "male",
    "chief_complaint": "rapidly enlarging pulsatile mass on medial right upper extremity in a 41-day-old infant",
    "known_conditions": [
      "hypoxic-ischemic encephalopathy",
      "Lennox-Gastaut syndrome without status epilepticus"
    ],
    "known_allergies": []
  },
  "medication_list": [
    "intravenous heparin 10 U/kg/h for 48 hours",
    "oral acetaminophen 160mg/5mL suspension as needed"
  ],
  "patient_transcript": "Doctor: Hi, how are you today?\nParent: I'm good, thanks.\nDoctor: Great. Can you tell me what brought you here today?\nParent: My baby is here for evaluation of a rapidly enlarging mass on his right arm.\nDoctor: I see. Can you tell me a bit more about your baby?\nParent: He's a 41-day-old male infant with hypoxic-ischemic encephalopathy.\nDoctor: And when was the mass first noticed?\nParent: It was about 5 hours ago.\nDoctor: And has it been rapidly enlarging since then?\nParent: Yes, it has been getting bigger.\nDoctor: Has your baby had any previous medical procedures on that arm?\nParent: Yes, he had a PICC line placed there during the neonatal period for treatment of Lennox-Gastaut syndrome without status epilepticus.\nDoctor: Understood. What did you notice on the physical examination?\nParent: The mass was pulsatile, but his capillary refill was within 2 seconds, pulses were good in all extremities, his arms and legs were warm, and there was no discoloration or swelling.\nDoctor: We obtained a CT angiogram, which showed a pseudoaneurysm of the right distal brachial artery measuring about 1.8 by 1.6 by 2.1 cm.\nParent: Okay.\nDoctor: An MRI then showed a 2.1 by 1.7 by 1.1 cm mass along the right brachial artery with vascular flow, consistent with a pseudoaneurysm.\nParent: I see.\nDoctor: Because of concern for a vascular abnormality related to the prior line, we admitted him to the neonatal intensive care unit for observation. Over the next two days the mass continued to grow, and plastic surgery and vascular surgery were consulted. Your baby is scheduled for microscope-assisted brachial artery repair with both teams involved.\nParent: Thank you for explaining.",
  "chart_notes": "39-week term, 41-day-old male infant with hypoxic-ischemic encephalopathy presented to the ED with a rapidly enlarging, pulsatile mass on the medial aspect of the right upper extremity. Parents first noticed the mass 5 hours before arrival; it had enlarged rapidly. Neurovascular exam showed a warm, well-perfused limb with 2+ brachial, radial, and ulnar pulses, capillary refill <2 seconds, no discoloration or edema, and age-appropriate movement of all extremities. Past history notable for PICC placement in the same region during the neonatal period for treatment of Lennox-Gastaut syndrome without status epilepticus. CT angiography demonstrated a pseudoaneurysm of the right distal brachial artery measuring approximately 1.8 × 1.6 × 2.1 cm with clear communication to the brachial artery lumen and no other vascular abnormalities. Contrast-enhanced MRI confirmed a 2.1 × 1.7 × 1.1 cm mass along the right brachial artery with vascular flow. The infant was admitted to the NICU for observation; over 2 days the mass continued to grow, and plastic and vascular surgery teams were consulted. Under general anesthesia, the pseudoaneurysm was exposed via curvilinear incision at the elbow, the diseased segment resected, and a tension-free end-to-end microvascular anastomosis of the brachial artery (2 mm diameter) was performed with 9-0 nylon. Postoperatively, the infant received low-dose intravenous heparin (10 U/kg/h) for 48 hours, had warm, well-perfused upper extremities without bleeding, and was discharged on postoperative day 3 with an arm splint and oral acetaminophen suspension for pain. At 2-year follow-up, the surgical site was well healed, brachial/ulnar/radial pulses were symmetric, and right upper extremity function was normal."
}
