{
  "case_id": "case_03",
  "data_source": "agbonnet",
  "difficulty": "complex",
  "patient_history": {
    "age": 67,
    "sex": "female",
    "chief_complaint": "left hip pain and enlarging mass with recurrent falls",
    "known_conditions": [
      "high-grade undifferentiated pleomorphic sarcoma of left hip",
      "acromegaly (pituitary tumor resection)",
      "hypertension",
      "recurrent vertigo"
    ],
    "known_allergies": []
  },
  "medication_list": [
    "oxycodone/acetaminophen (Percocet 10/325 mg) twice daily",
    "acetaminophen 500mg as needed for pain"
  ],
  "patient_transcript": "Doctor: Hi, I'm your doctor. Can you tell me about your symptoms?\nPatient: Yes, I had a bump on my hip and felt a lot of pain after I fell 11 months ago.\nDoctor: Hmm, I see. What did the emergency room diagnose you with?\nPatient: They said it was a hematoma around my hip.\nDoctor: I understand. And did your symptoms worsen over time?\nPatient: Yes, I had recurrent falls.\nDoctor: Okay. Did you have any radiographic imaging done?\nPatient: Yes, I had a CT scan without intravenous contrast done six weeks before I was diagnosed with cancer.\nDoctor: And what did the CT scan show?\nPatient: It confirmed that I didn't have a displaced fracture, but it indicated a tissue collection that was suspicious for a hematoma.\nDoctor: I see. And then, did you have an MRI done?\nPatient: Yes, I did. The MRI demonstrated a soft-tissue mass in my left hip that was suspicious for sarcoma.\nDoctor: Okay, got it. And then you had a consultation with an orthopedic oncologic specialist, right?\nPatient: Yes, I did. And I underwent a radical resection of the sarcoma the next day.\nDoctor: Okay. I have your pathology report here. It says that you were diagnosed with a high-grade undifferentiated pleomorphic sarcoma. The margins were negative and the closest evidence of cancer was 2 mm within surgical margins.\nPatient: Hmm.\nDoctor: And after the surgery, you had a chest CT that showed two tiny lung nodules with the larger nodule measuring 4 mm. This indicates a recommended follow-up of three to six months.\nPatient: Okay.\nDoctor: Also, there was a small hypodense lesion in your spleen that was inadequately visualized.\nPatient: Hmm.\nDoctor: The tumor stage was established to be Stage III measuring 13.5 cm at its greatest dimension. And the TNM staging was established to be pT2a, cN0, cM0 without evidence of lymph node involvement or distant metastases.\nPatient: Okay.\nDoctor: You had two follow-up appointments with the surgeon, who recommended a consult to medical and radiation oncology. And you had consultations at two other institutions including a sarcoma clinic.\nPatient: Yes, I did.\nDoctor: And they recommended adjuvant chemotherapy for you.\nPatient: Yes, they did.\nDoctor: Okay, I will schedule a follow-up appointment for you. It's important that you follow the recommendations of the medical and radiation oncologists.\nPatient: Yes, I will. Thank you, doctor.",
  "chart_notes": "67-year-old woman with a rapidly enlarging left hip mass after a fall 11 months earlier. Initially diagnosed as a hematoma around the proximal femur in the emergency department, but symptoms worsened with recurrent falls. CT without contrast showed a nonspecific left thigh tissue collection; subsequent MRI demonstrated a soft-tissue mass in the subcutaneous tissue of the left hip suspicious for sarcoma. She underwent radical resection of the mass one week after MRI. Pathology revealed a 13.5 cm superficial left hip undifferentiated high-grade pleomorphic sarcoma with 50-60% necrosis and negative margins (closest tumor 2 mm). Staging chest CT one week post-op showed two tiny lung nodules (largest 4 mm) and a small hypodense splenic lesion; staged pT2a cN0 cM0 (Stage III). She later received adjuvant radiation (60 Gy) and was followed by oncology; surveillance imaging demonstrated new pulmonary nodules concerning for metastasis and a large left hip fluid collection (seroma vs chronic hematoma vs abscess). She presents to physical therapy with left shoulder, flank, and hip pain, lymphedema of the left lower extremity and abdomen, and functional limitations in sleep, standing, dressing, and household activities; current pain control uses Percocet 10/325 mg twice daily and acetaminophen 500 mg as needed."
}
