{
  "case_id": "case_09",
  "data_source": "agbonnet",
  "difficulty": "complex",
  "patient_history": {
    "age": 29,
    "sex": "female",
    "chief_complaint": "sudden onset chest pain and shortness of breath while visiting baby in NICU",
    "known_conditions": [
      "systemic lupus erythematosus",
      "severe idiopathic thrombocytopenic purpura",
      "triple-positive antiphospholipid syndrome",
      "Class IV lupus nephritis",
      "spontaneous deep vein thrombosis"
    ],
    "known_allergies": []
  },
  "medication_list": [
    "enoxaparin 100mg daily",
    "aspirin 100mg daily",
    "hydroxychloroquine 400mg daily",
    "azathioprine 150mg daily",
    "prednisone 5mg daily",
    "calcitriol 0.25 mcg daily",
    "calcium carbonate 1.25g daily"
  ],
  "patient_transcript": "Doctor: Hi, I am Dr. [Name]. How are you feeling today?\nPatient: Not so good, I have chest pain and shortness of breath.\nDoctor: I see. Can you tell me a bit about your history?\nPatient: I was diagnosed with lupus when I was 12 years old and I have severe thrombocytopaenic purpura.\nDoctor: Hmm, okay. And how long have you been experiencing these symptoms?\nPatient: Just today, when I was visiting my baby in the Neonatal Intensive Care Unit.\nDoctor: I see. And what happened during the examination?\nPatient: They found that I had tachycardia, but my blood pressure and oxygen saturation were normal.\nDoctor: Okay. And what medications were you taking at the time?\nPatient: I was taking enoxaparin and aspirin, and I was going to transition to warfarin in 2 weeks.\nDoctor: Okay. And what was your immunosuppression regime like?\nPatient: I was taking hydroxychloroquine, azathioprine, and prednisone, and some other medications like calcitriol and calcium carbonate.\nDoctor: I see. And what did the Electrocardiogram show?\nPatient: It showed sinus tachycardia but no ischaemic changes.\nDoctor: Okay. And the Chest X-ray?\nPatient: It showed cardiomegaly with increased interstitial markings.\nDoctor: I see. And what happened after that?\nPatient: I deteriorated rapidly over the next hour with climbing oxygen requirements and hypotension.\nDoctor: Okay. And were you investigated for pulmonary embolism?\nPatient: Yes, I was. And I was treated with morphine and enoxaparin.\nDoctor: Okay. And then you had a CT pulmonary angiography, right?\nPatient: Yes, I did.\nDoctor: And what did that show?\nPatient: It showed pulmonary oedema but no PE.\nDoctor: Okay. And then you were admitted to the cardiovascular intensive care, right?\nPatient: Yes, I was.\nDoctor: And were you intubated for respiratory distress?\nPatient: Yes, I was.\nDoctor: And did you have a transthoracic echocardiogram?\nPatient: No, I didn't. But I had a transoesophageal echocardiogram which demonstrated the posterolateral papillary muscle rupture and flail anterior leaflet.\nDoctor: I see. And then you proceeded to emergency mitral valve replacement, right?\nPatient: Yes, I did.\nDoctor: And what happened during the operation?\nPatient: I had a pulseless electrical activity arrest and was resuscitated with adrenaline and CPR.\nDoctor: I see. And what was the result of the intervention?\nPatient: The posterolateral papillary muscle was pale and sheared off the ventricular wall, and they replaced my mitral valve with a mechanical valve.\nDoctor: And after the procedure?\nPatient: They had to put me on ECMO because of severe pulmonary oedema and heart failure.\nDoctor: Okay. And the histology of the valve?\nPatient: It showed deposits consistent with Libman-Sacks endocarditis, and the papillary muscle showed infarction several days old.\nDoctor: I see. And after ECMO was removed?\nPatient: I had some abnormal movements so they did an MRI which showed hypoxic brain injury, but my neurological function recovered to normal before discharge.\nDoctor: And your medications at discharge?\nPatient: They added metoprolol and cilazapril, and transitioned me from heparin to warfarin with aspirin.",
  "chart_notes": "29-year-old woman with SLE diagnosed at age 12 complicated by severe ITP, spontaneous DVT, triple-positive antiphospholipid syndrome, and Class IV lupus nephritis. Presented acutely postpartum while visiting baby in NICU with sudden chest pain and dyspnea. Examination: tachycardia, normotensive, normal O2 sat initially. Medications: enoxaparin 100mg daily, aspirin 100mg daily, hydroxychloroquine 400mg daily, azathioprine 150mg daily, prednisone 5mg daily, calcitriol 0.25 mcg daily, calcium carbonate 1.25g daily. ECG: sinus tachycardia, no ischaemic changes. CXR: cardiomegaly with increased interstitial markings. Rapid deterioration over next hour with climbing O2 requirements and hypotension. CTPA: pulmonary oedema, no PE. Admitted to CVICU, intubated for respiratory distress. TEE: posterolateral papillary muscle rupture with flail anterior mitral leaflet and torrential mitral regurgitation, preserved LV function. Emergency MV replacement with 29mm St Jude mechanical valve. PEA arrest on transfer to operating table, resuscitated with adrenaline and CPR. Intraoperative: posterolateral papillary muscle pale and sheared off ventricular wall. VA-ECMO instituted for persistent biventricular failure. Histology: preserved valve architecture with fibrinous deposits and focal vegetation with inflammatory cells, no organisms, consistent with chronic Libman-Sacks endocarditis. Papillary muscle: extensive central necrosis with surrounding acute inflammation consistent with infarction several days old, intramyocardial artery thrombi. ECMO weaned at day 2. MRI brain: widespread hypoxic injury. Paroxysmal atrial fibrillation and mild LV impairment postoperatively. Discharged on metoprolol CR, cilazapril, warfarin, aspirin, plus continued immunosuppression. Neurological function normal at discharge."
}
