{
  "case_id": "case_08",
  "data_source": "agbonnet",
  "difficulty": "simple",
  "patient_history": {
    "age": 8,
    "sex": "male",
    "chief_complaint": "painful red lumps, pus discharge, and alopecia on the back of the head for 2 weeks",
    "known_conditions": [
      "impetigenic scabies (Sarcoptes scabiei confirmed on skin scraping microscopy)"
    ],
    "known_allergies": []
  },
  "medication_list": [
    "permethrin 5% cream topical",
    "cetirizine syrup",
    "amoxicillin oral"
  ],
  "patient_transcript": "Doctor: Hello, how can I help you today?\nPatient: Hi, doctor. I have some lumps on my head that are painful and have pus discharge.\nDoctor: Okay, let me take a look. Can you show me the lumps?\nPatient: Yes, they are on the back of my head.\nDoctor: Hmm, I see. Can you tell me more about your symptoms? Have you had any rashes or itching?\nPatient: Yes, I have had rashes and itching for the past two weeks. They are especially severe in the afternoon and evening.\nDoctor: I see. Have you been given any treatment for this?\nPatient: No, I haven't.\nDoctor: Okay. Did your mother notice anything about the rashes and itching?\nPatient: Yes, she noticed that the alopecia in the pruritic area and the rash had increased. And I started to complain of pain in the head area.\nDoctor: I see. That's why you decided to come for treatment today. Is that right?\nPatient: Yes, that's right.\nDoctor: Do you have a history of fever?\nPatient: No, I don't.\nDoctor: What about your twin? Do they have similar complaints?\nPatient: Yes, they do. They have alopecia, red lumps, and pus discharge. But we did not find other family members with the same complaints.\nDoctor: I see. Can you tell me more about your history? Have you been playing with stray cats in front of your house?\nPatient: Yes, I have. And my family said that I have poor hygiene.\nDoctor: Okay. I have obtained informed consent from you and your family for your case and images to be published in a manuscript. And it has been approved by the Department of Dermatology and Venereology, Faculty of Medicine, Universitas Sumatera Utara.\nPatient: Okay.\nDoctor: Now, let me examine you. During the dermatological examination, I found multiple erythematous nodules with sinuses in the scalp of the parieto-occipital area and alopecia. There is tenderness in the area of the lesion.\nPatient: Hmm.\nDoctor: On palpation, there is no palpable enlargement of the lymph nodes. And there is no lesion in the other parts of your body.\nPatient: Okay.\nDoctor: Based on the history and physical examination, the differential diagnosis in your case is kerion type tinea capitis and impetigenic scabies.\nPatient: Hmm.\nDoctor: We have examined skin scrapings in the lesion area using KOH 10% and examined it under a light microscope, which did not show any fungal elements. The culture also showed a negative result.\nPatient: Okay.\nDoctor: I would like to prescribe some medication for you. You need to take it regularly and come back for a follow-up in two weeks.\nPatient: Okay, doctor. Thank you.",
  "chart_notes": "8yo male presented to dermatology clinic with 2-week history of painful erythematous nodules with pus discharge and alopecia over the parieto-occipital scalp. Symptoms began as pruritus and rashes on the scalp, worsening in afternoon and evening. No prior treatment. Mother noted progressive alopecia and rash increase over the past week with onset of pain. No fever. Twin brother has identical complaints (alopecia, red lumps, pus discharge); no other affected family members. History of contact with stray cats; family reports poor hygiene. Dermatological examination: multiple erythematous nodules with sinuses in the parieto-occipital scalp, alopecia, tenderness over lesions. No lymphadenopathy. No lesions elsewhere on body. KOH 10% skin scraping: no fungal elements seen. Fungal culture: negative. Skin scraping microscopy: Sarcoptes scabiei mite identified (Department of Microbiology, Faculty of Medicine, Universitas Sumatera Utara). Diagnosis: impetigenic scabies. Treatment: permethrin 5% cream applied once for 8 hours, cetirizine syrup 1 teaspoon once daily, amoxicillin oral. Twin treated identically. Weekly follow-up: weeks 1-3 showed progressive improvement in pruritus and pain; by week 3 hair regrowth initiated with erythematous macules replacing prior nodules. At final visit: complete hair regrowth. Twin had identical clinical response."
}
