{
  "case_id": "case_10",
  "data_source": "agbonnet",
  "difficulty": "moderate",
  "patient_history": {
    "age": 53,
    "sex": "male",
    "chief_complaint": "acute left upper quadrant abdominal pain for 4 days with radiation to back",
    "known_conditions": [
      "chronic pancreatitis",
      "insulin-dependent diabetes mellitus",
      "hypertension",
      "peripheral arterial disease",
      "gout"
    ],
    "known_allergies": []
  },
  "medication_list": [
    "insulin",
    "metformin 500mg daily",
    "lisinopril 40mg daily",
    "amlodipine 10mg daily",
    "metoprolol 25mg twice per day",
    "rosuvastatin 40mg per day",
    "aspirin 81mg",
    "clopidogrel 75mg per day",
    "allopurinol 100mg"
  ],
  "patient_transcript": "Doctor: Good morning, I am Dr. Smith. Can you tell me what brings you in today?\nPatient: Good morning, I have been having some abdominal pain for the past 4 days.\nDoctor: I see. Can you describe the pain for me?\nPatient: It's postprandial and sharp, and sometimes it radiates to my back.\nDoctor: Hmm, okay. Can you tell me a little bit about your past medical history?\nPatient: I am an African American male and I have a past medical history of chronic pancreatitis, insulin-dependent diabetes, hypertension, peripheral arterial disease, and gout.\nDoctor: I see. And what medications are you currently taking?\nPatient: I am taking insulin, metformin 500mg daily, lisinopril 40mg daily, amlodipine 10mg daily, metoprolol 25mg twice a day, rosuvastatin 40mg per day, aspirin 81mg, clopidogrel 75mg per day, and allopurinol 100mg.\nDoctor: Okay. And can you tell me about your family history?\nPatient: My mother had insulin-dependent diabetes and hypertension, and my father had hypertension.\nDoctor: Alright. Can you tell me about your alcohol and smoking habits?\nPatient: I used to smoke a few cigarettes a day, but I quit over 5 years prior to my initial presentation. I reported drinking around four alcoholic beverages daily.\nDoctor: Okay. And can you tell me about your previous visits to the emergency room?\nPatient: 18 months prior to my current presentation, I went to the emergency room with postprandial abdominal pain.\nDoctor: I see. And what was the outcome of that visit?\nPatient: I had a CT scan of my abdomen and it showed necrotizing acute pancreatitis and a fluid collection between my pancreas and stomach. I was managed supportively and discharged.\nDoctor: Alright. And did you have any other visits to the emergency room after that?\nPatient: A few months later, I was admitted for diabetic ketoacidosis secondary to pancreatic necrosis.\nDoctor: Okay. And did you have any abdominal imaging done at that visit?\nPatient: No, I didn't.\nDoctor: Alright. And did you have any follow-up CT scans after your initial episode of acute pancreatitis?\nPatient: Yes, I did. I had a repeat CT scan 5 months after my initial episode, or 2 months after my diabetic ketoacidosis admission, and it showed no change in size of the pancreatic pseudocyst.\nDoctor: Okay. And can you describe the pain you are experiencing now compared to the pain you experienced 18 months ago?\nPatient: The pain is of different character than the original episode of acute pancreatitis 18 months ago, but I am unable to specifically describe how.\nDoctor: Alright. I am going to do a physical examination now. Is that okay?\nPatient: Yes, that's fine.\nDoctor: Okay, I have finished the examination. You are an alert patient, but you are tachycardic to 110 beats per minute and have decreased breath sounds at the bilateral lung bases. Your abdomen is nontender but mildly distended. Your neurologic examination is unremarkable.\nPatient: Okay.\nDoctor: Based on your symptoms and medical history, I think you may be experiencing another episode of acute pancreatitis. I am going to order a CT scan of your abdomen to confirm the diagnosis.\nPatient: Okay.\nDoctor: In the meantime, I want you to rest and avoid eating solid foods. I will also adjust your medications to help manage your pain.\nDoctor: I will see you again after the results of the CT scan are back. Is there anything else you would like to ask me?\nPatient: No, that's all. Thank you.\nDoctor: You're welcome. Take care.",
  "chart_notes": "53-year-old African American male with chronic pancreatitis, insulin-dependent diabetes, hypertension, peripheral arterial disease, and gout presented with 4 days of postprandial sharp LUQ abdominal pain radiating to back. Prior history of necrotizing acute pancreatitis 18 months ago with 7.1x2.8x8.8 cm pancreatic pseudocyst managed conservatively, subsequent DKA admission secondary to pancreatic necrosis, and stable pseudocyst on 5-month follow-up CT. Current pain described as different character from prior episode. Home medications: insulin, metformin 500mg daily, lisinopril 40mg daily, amlodipine 10mg daily, metoprolol 25mg BID, rosuvastatin 40mg daily, aspirin 81mg, clopidogrel 75mg daily, allopurinol 100mg. Social history: former smoker (quit >5 years ago), reports ~4 alcoholic beverages daily. Family history: mother with insulin-dependent DM and HTN, father with HTN. Vitals: T 37.4C, BP 161/88, HR 90, O2 sat 100% RA. Exam: alert, tachycardic, decreased bilateral basilar breath sounds, abdomen nontender but mildly distended, neuro unremarkable. Labs: WBC 14.7, Hgb 16.7, glucose 221, HbA1c 11.3%, bicarb 23 (no DKA), lipase 145 U/L, electrolytes/renal/liver unremarkable. CT abdomen: pseudocyst enlarged to 15.9x10.4 cm displacing stomach and compressing splenic vasculature. Clopidogrel held; other home meds continued. Received IV NS 100 mL/h, acetaminophen 650mg q6h, oxycodone 5mg q4h PRN, IV morphine 4mg q4h PRN. Endoscopic cystogastrostomy performed, 1.1L drained, stent placed. Post-procedure: respiratory distress (O2 sat 93% on 15L NRB), new left flank pain, WBC 19.8. CXR: new moderate left pleural effusion. CT chest: new left-flank fat stranding. Started levofloxacin 750mg daily and IV metronidazole 500mg q8h. Thoracentesis: 700mL exudative fluid (LDH 591, amylase 115, pH 7.58). Further CT: decreased pseudocyst but new large left subdiaphragmatic collection communicating with subcapsular splenic hematoma. Exploratory laparotomy: significant inflammation, malrotated spleen, 300mL splenic abscess, grade IV splenic laceration with subcapsular hematoma. Splenectomy performed. Pleural effusion drained via chest tube, resolved 2 weeks prior to discharge. Discharged after protracted postoperative course. No surgical complications at 7-month follow-up."
}
